{
  "state_name": "a_full_nights_rest",
  "description": "A fully restored cognitive and physiological baseline characterized by strong memory consolidation, low fatigue, and effective system maintenance.",
  "brain_regions": [
    {
      "name": "thalamus",
      "activation": 0.4
    },
    {
      "name": "hippocampus",
      "activation": 0.9
    }
  ],
  "ai_analog": "System reset / memory consolidation / low CPU temp",
  "ai_modules": [
    { "name": "memory_consolidation", "activation": 0.9 },
    { "name": "fatigue", "activation": 0.1 },
    { "name": "error_correction", "activation": 0.7 },
    { "name": "system_maintenance", "activation": 0.6 }
  ],
  "metadata": {
    "category": "physiological",
    "intensity": "low",
    "source": "manual"
  }
}
