{
  "state_name": "digital_overstimulation_screen_fatigue",
  "description": "A state of sensory and cognitive overload caused by sustained high-intensity digital input, characterized by excessive visual processing demand, frequent context switching, rising processing strain, and reduced executive control.",
  "brain_regions": [
    { "name": "visual_cortex", "activation": 0.9 },
    { "name": "prefrontal_cortex", "activation": 0.3 }
  ],
  "ai_analog": "Multimodal sensory I/O overload / GPU bottlenecks",
  "ai_modules": [
    { "name": "visual_input", "activation": 1.0 },
    { "name": "context_switching", "activation": 0.9 },
    { "name": "processing_heat", "activation": 0.8 },
    { "name": "cognitive_saturation", "activation": 0.85 }
  ],
  "metadata": {
    "category": "physiological",
    "intensity": "high",
    "source": "manual"
  }
}
