{
  "state_name": "flow",
  "description": "An optimal cognitive state characterized by deep task immersion, efficient feedback loops, minimal latency, and strong coordination between executive control and action systems.",
  "brain_regions": [
    { "name": "prefrontal_cortex", "activation": 0.8 },
    { "name": "motor_cortex", "activation": 0.9 }
  ],
  "ai_analog": "Optimized feedback loop / minimal latency in recurrent tasks",
  "ai_modules": [
    { "name": "feedback_loop", "activation": 0.95 },
    { "name": "task_focus", "activation": 0.9 },
    { "name": "background_noise_filtering", "activation": 0.85 },
    { "name": "latency_management", "activation": 0.95 }
  ],
  "metadata": {
    "category": "cognitive",
    "intensity": "medium",
    "source": "manual"
  }
}
