{
  "state_name": "anxiety",
  "description": "Heightened threat sensitivity, vigilance, and negative prediction bias.",
  "brain_regions": [
    { "name": "amygdala", "activation": 0.95 },
    { "name": "insula", "activation": 0.70 }
  ],
  "ai_analog": "Persistent threat simulation / hyperactive prediction loop / elevated error vigilance",
  "ai_modules": [
    { "name": "threat_simulation", "activation": 0.95 },
    { "name": "error_prediction", "activation": 0.90 },
    { "name": "attention_bias_to_negative_signals", "activation": 0.85 },
    { "name": "inhibition_control", "activation": 0.40 }
  ],
  "metadata": {
    "category": "emotional",
    "intensity": "high",
    "source": "manual"
  }
}
